{
  "id": "cruzadas-2026-09-12",
  "cycleDate": "2026-09-12",
  "word": "PEDRO",
  "normalizedWord": "PEDRO",
  "wordLength": 5,
  "initialClue": "O Apóstolo e primeira rocha da Igreja",
  "postGameContext": "Simão Pedro recebeu de Cristo a primazia pastoral após sua solene confissão de fé em Cesareia de Filipe.",
  "sourceCitation": "Mateus 16, 18-19; João 21, 15-17",
  "sourceCategory": "Sagrada Escritura",
  "editorialStatus": "Draft"
}