{
  "id": "cruzadas-2026-09-12",
  "cycleDate": "2026-09-12",
  "word": "BENTO",
  "normalizedWord": "BENTO",
  "wordLength": 5,
  "initialClue": "Patriarca dos monges do Ocidente e pai da regra Ora et Labora",
  "postGameContext": "São Bento de Núrsia fundou o Mosteiro de Monte Cassino e estruturou o monaquismo ocidental.",
  "sourceCitation": "História Eclesiástica; Diálogos de São Gregório Magno, Livro II",
  "sourceCategory": "História Eclesiástica Documentada",
  "editorialStatus": "Verified"
}