{
  "id": "cruzadas-2026-09-11",
  "cycleDate": "2026-09-11",
  "word": "AÇÃO",
  "normalizedWord": "ACAO",
  "wordLength": 4,
  "initialClue": "Atitude cristã de graças e virtude ativa",
  "postGameContext": "A ação de graças (Eucaristia) é a oração por excelência da comunidade cristã reunida.",
  "sourceCitation": "Catecismo da Igreja Católica, §1328; 1Tessalonicenses 5, 18",
  "sourceCategory": "Sagrada Escritura",
  "editorialStatus": "Verified"
}