{
  "id": "cruzadas-2026-09-11",
  "cycleDate": "2026-09-11",
  "word": "GRAÇA",
  "normalizedWord": "GRACA",
  "wordLength": 5,
  "initialClue": "Dom gratuito e sobrenatural de Deus",
  "postGameContext": "A graça santificante é o dom estável e sobrenatural que aperfeiçoa a alma para torná-la capaz de viver com Deus.",
  "sourceCitation": "Catecismo da Igreja Católica, §1996–2000",
  "sourceCategory": "Catecismo da Igreja Católica",
  "editorialStatus": "Draft"
}