{
  "id": "cruzadas-2026-09-13",
  "cycleDate": "2026-09-13",
  "word": "CRUZ",
  "normalizedWord": "CRUZ",
  "wordLength": 4,
  "initialClue": "Símbolo máximo da redenção e do amor de Cristo pela humanidade",
  "postGameContext": "Na festa da Exaltação da Santa Cruz, a Igreja contempla o instrumento de nossa salvação.",
  "sourceCitation": "Liturgia das Horas, Próprio dos Santos; Gálatas 6, 14",
  "sourceCategory": "Liturgia Oficial e Calendário Geral",
  "editorialStatus": "Verified"
}