{
  "id": "cruzadas-2026-09-10",
  "cycleDate": "2026-09-10",
  "word": "MARIA",
  "normalizedWord": "MARIA",
  "wordLength": 5,
  "initialClue": "Mãe de Jesus e modelo de fidelidade",
  "postGameContext": "Maria Santíssima, a Theotokos (Mãe de Deus), proclamada pelo Concílio de Éfeso em 431.",
  "sourceCitation": "Catecismo da Igreja Católica, §495; Concílio de Éfeso (431 d.C.)",
  "sourceCategory": "Catecismo da Igreja Católica",
  "editorialStatus": "Verified"
}