{
  "id": "cruzadas-2026-09-14",
  "cycleDate": "2026-09-14",
  "word": "PEDRO",
  "normalizedWord": "PEDRO",
  "wordLength": 5,
  "initialClue": "A rocha sobre a qual Cristo edificou Sua Igreja",
  "postGameContext": "Simão, a quem Jesus chamou Pedro, primeiro entre os Apóstolos e bispo de Roma.",
  "sourceCitation": "Evangelho segundo São Mateus 16, 18",
  "sourceCategory": "Sagrada Escritura",
  "editorialStatus": "Draft"
}
